" Frank border heater, an electric heater, the elements were made of wire and clay, reached out to touch and he heard a voice say,",26.86,60.79
" Everybody say, Come on and plug me in, I want to feel that heat begin,",63.15,81.01
" Don't move till the morning comes, and you can fly up to the sun, so come on and plug me in, plug me in, plug me in.",84.47,101.93
" Frank liked his heater, his electric heater, upstairs alone with the elements he dreamt of gold and frankincense,",114.7,143.4
" and frankincense, and heard it say, Come on and plug me in, I want to feel that heat begin,",143.4,161.6
" Come closer and smile and say, I want to melt your precious wings, so come on and plug me in, plug me in, plug me in.",166.44,183.64
" Come on and plug me in, come on and plug me in, I want to feel that heat begin,",207.82,231.67
" Though my body is rusting through, I have carried this song for you, it's from the sphinx and the serpent to plug me in,",235.75,255.47
